cristina@cristina-HP-EliteBook-840-G3:~$ sudo hddtemp /dev/sda
[sudo] password for cristina: 


/dev/sda: SanDisk SD7SN6S-256G-100 6              �: 36°C



cristina@cristina-HP-EliteBook-840-G3:~$ ^C
Cristina sent Today at 10:15 AM










cristina@cristina-HP-EliteBook-840-G3:~$ sudo smartctl -A /dev/sda



smartctl 7.1 2019-12-30 r5022 [x86_64-linux-5.8.0-50-generic] (local build)
Copyright (C) 2002-19, Bruce Allen, Christian Franke, www.smartmontools.org

=== START OF READ SMART DATA SECTION ===
SMART Attributes Data Structure revision number: 16
Vendor Specific SMART Attributes with Thresholds:
ID# ATTRIBUTE_NAME          FLAG     VALUE WORST THRESH TYPE      UPDATED  WHEN_FAILED RAW_VALUE
  1 Raw_Read_Error_Rate     0x002f   100   100   002    Pre-fail  Always       -       0
  5 Reallocated_Sector_Ct   0x0033   100   100   010    Pre-fail  Always       -       0
  9 Power_On_Hours          0x0032   095   095   ---    Old_age   Always       -       2256
 12 Power_Cycle_Count       0x0032   100   100   ---    Old_age   Always       -       1376
171 Program_Fail_Count      0x0022   100   100   ---    Old_age   Always       -       0
172 Erase_Fail_Count        0x0032   100   100   ---    Old_age   Always       -       0
173 Avg_Write/Erase_Count   0x0033   096   096   005    Pre-fail  Always       -       90197983246
174 Unexpect_Power_Loss_Ct  0x0032   100   100   ---    Old_age   Always       -       65
184 End-to-End_Error        0x0033   100   100   097    Pre-fail  Always       -       0
187 Reported_Uncorrect      0x0032   100   100   ---    Old_age   Always       -       0
188 Command_Timeout         0x0032   100   098   ---    Old_age   Always       -       147
194 Temperature_Celsius     0x0022   064   030   014    Old_age   Always       -       36 (Min/Max 6/70 #27)
196 Reallocated_Event_Count 0x0032   100   100   ---    Old_age   Always       -       0
199 SATA_CRC_Error          0x0022   100   100   ---    Old_age   Always       -       0
230 Perc_Write/Erase_Count  0x0032   100   100   ---    Old_age   Always       -       602 1099 1099
244 Thermal_Throttle        0x0032   000   100   ---    Old_age   Always       -       0

cristina@cristina-HP-EliteBook-840-G3:~$